id,genji_half,quijote_half,review
gq-0272,Genji was in attendance upon the Emperor,"for two bushels of laughter, which the account of how he behaved himself in office will give thee.",
gq-0274,"He constantly discussed the matter with Genji,",covering him up well so that he might sweat out any chill caught after his dancing.,
gq-0276,"And Genji, smarting under the rebuke, was about to defend himself","an honest man (if indeed that title can be given to him who is poor), but with very little wit in his pate.",
gq-0277,It is to see Prince Genji,and even the very goatherds and shepherds perceived how exceedingly out of his wits our Don Quixote was.,
gq-0278,"The Commander of this Bodyguard is not generally allotted a Palace-Officer as his special attendant,",having first with rough politeness pressed Don Quixote to take a seat upon a trough which they placed for him upside down.,
gq-0279,But at this moment a number,who thought it rare good fortune to receive such a knight-errant and such a homely squire in their castle.,
gq-0281,"But fortunately some of her companions had more discretion than their mistress, and out of consideration","he ordered them to desist and was at once obeyed, so the girdle escaped.",E
gq-0282,The whole household was plunged into such a state of anxiety,but of this Don Quixote knew nothing as yet.,E
gq-0285,The child reminded Genji of the Heir Apparent,"who told him that notwithstanding this he would not cancel the order for the three ass-colts, for which Sancho thanked him.",
gq-0286,This news was brought to Genji in the Palace,"and the curate contrived with no small trouble to get Don Quixote on the bed, and he fell asleep with every appearance of excessive weariness.",
gq-0288,"If even Genji had reason to believe in her guilt,","and the loss of his wine, swearing that neither Rocinante nor Sancho’s ass should leave the inn until he had been paid to the very last farthing.",
gq-0290,Still gazing with eager admiration,"and embarrassed with his lance, which he either could not manage, or had no time to lay in rest.",
gq-0291,"It is in general the unexplored that attracts us, and Genji tended","some village where he could plaster himself, as has been said already.",E
gq-0292,"When Genji had retired to the eastern wing, he","bade the one with the jug go and fetch some, while Señor Don Quixote waited.",E
gq-0293,They naturally assumed that she was not feeling well and were glancing at her with sympathy,"and Don Quixote stood up, as well as all who were watching the slow-moving procession.",
gq-0295,The Minister of the Right was aware that his youngest daughter was still pining,with a surcoat of tawny cloth,E
gq-0296,His resemblance to the Heir Apparent was certainly very striking,and the bachelor asked who had brought the letters.,E
gq-0299,To this appeal were added the protests of her waiting-ladies who were,"at table discussing a great variety of things, but all bearing on the calling of arms and knight-errantry.",E
gq-0300,It was from Genji,and tearing his beard and cursing the hour and the occasion when fortune had made him acquainted with him.,
gq-0301,Weak though he was the sick man first gave minute instructions as to the upbringing of the Heir Apparent,"and her daughter remained perfectly contented when they saw that any way the affair must end in marriage, and Tosilos wanted nothing else.",
gq-0303,"Kōkiden had never forgiven him for marrying the late princess his daughter to Genji instead of giving her,","the very physiognomy, the very effigy, the very image of the bachelor Samson Carrasco!",
gq-0304,"Genji continued to visit him as before and was assiduous in his attention to Aoi’s maids-of-honour,","and they soon had him well soaped and washed, and having wiped him dry they made their obeisance and retired.",
gq-0305,The high position to which Genji had been raised two years ago had entailed much tiresome business,"for six days, during which he was often visited by his friends the curate, the bachelor, and the barber, while his good squire Sancho Panza never quitted his bedside.",
gq-0306,The young Emperor punctiliously obeyed his father’s last injunctions,and with no less good-will than the curate offered his services in any way that might be of use to them.,E
gq-0308,Nor was Genji on his side,for he now considered there was no necessity for mounting guard over the castle any longer.,E
gq-0309,"It was very awkward that there was no one to advise her about the child except Prince Genji,","and there for the present we will leave them, for such is Cide Hamete’s pleasure.",E
gq-0310,"There was a sound of footsteps, and Genji, still but half conscious,","and the history will return to him again at the proper time, so as not to omit making merry with Don Quixote now.",
gq-0312,The sole preoccupation of Ōmyōbu and the few other ladies who shared the secret,"Don Quixote set free in the Sierra Morena: a kindness for which he afterwards got poor thanks and worse payment from that evil-minded, ill-conditioned set.",
gq-0313,"For years Murasaki had served to keep Lady Fujitsubo,",warning him that most certainly they were windmills and not giants he was going to attack.,
gq-0314,"For a long while he paid no visit either to the Emperor or to the Heir Apparent,",did nothing at all that was of any use.,E
gq-0315,"Yet she well knew that if she showed her displeasure Genji would feel a disinclination towards the Heir Apparent,",at an early hour in full armour in the courtyard of the castle.,E
gq-0316,"On many occasions when she had travelled in even less state than this,","and by the side of the ladies, the curate and the barber.",E
gq-0317,"Genji too was longing to see his son,",he gave himself such rough treatment.,E
gq-0318,"This emboldened Genji, and soon he was telling the Emperor about his own visit to the Palace-in-the-Fields",and longing to see himself soon governor of the island his master had promised him.,
gq-0319,"Genji now took his leave,",but that he might eat when he had a mind.,
gq-0320,"Genji detained the messenger, and going to his desk opened the drawer where he kept his Chinese writing-paper",and had his ribs a little bruised.,
gq-0321,This rite was performed by Genji with a grace,and faint that he could not urge on his beast.,
gq-0323,"Seeing the messenger go away empty-handed,","as he was just then engaged in unloading a sumpter mule, well laden with provender, which these worthy gentlemen had brought with them.",
gq-0324,"Were Genji also now to desert the child,",until the final issue and end of the business.,E
gq-0326,"Genji too opened his library, and after exploring several cases which had not been unlocked",gave the barber a cuff that bathed his teeth in blood.,E
gq-0327,More than once Genji was,better than his master was.,
gq-0329,There were people everywhere,hearing the simplicity of the master he had so nicely befooled.,E
gq-0330,"Yes, there was Genji’s paper","and all filled, as it proved afterwards, with generous wines.",
gq-0331,Unfortunately he looked upon her as still more or less betrothed to Genji,for with the evening dews the blow of the staff made itself felt all the more.,
gq-0332,The young courtier vaguely hints,of this sudden dismounting and tying.,
gq-0333,"Ostensibly the poem refers to the late Emperor,",and madder than his master; and there were a good many just then who were of the same opinion.,
gq-0338,"There was one among them, Chūnagon by name, who, though she never spoke of it, had always cared",to sell it at the first opportunity.,E
gq-0339,"And indeed, as Genji realized,","where she was going, and what had induced her to dress herself in that garb.",
gq-0340,"His step-brother now fell to reminding him of scenes in their common childhood,",and the secretary fell back.,E
gq-0341,"Being without employment he had been obliged to go into service,",but waited for his master to act as taster.,E
gq-0343,"There was some sense in this,",about the providing of his inn or to keep it better provided.,
gq-0345,"Those who were with him knew the song well enough,",and vowed not to open his lips so long as he was in the company of these people.,
gq-0347,"Often he called to mind the picture of Murasaki’s misery in those last hours,",close to the aftermost rower on the right-hand side.,
gq-0351,"Of course I shall keep Lady Fujitsubo’s son as my Heir Apparent,","unless he had a very great desire to go to sleep, to come and spend the afternoon with her and her damsels in a very cool chamber.",
gq-0352,"Only Genji lay awake, propped high on his pillow,",squire to a knight called Don Quixote of La Mancha.,E
gq-0355,"The decision cost him a bitter struggle, but from Genji he hid all this,","and here let us leave the good Sancho; for his master, sorely troubled in mind by Altisidora’s music, has pressing claims upon us now.",
gq-0356,"If the other sisters, who did not know Genji, were in a flutter,",and he described it to the others; but he was unable to say what the dispute was about.,
gq-0357,"This letter was brought by his son the Governor of Echizen,","in Luscinda’s bosom the paper in which she declared that she was Cardenio’s wife, and never could be his.",
gq-0358,"They were soon willing to allow that in beauty of character Murasaki far excelled them all,","Don Quixote rinsed his mouth and bathed his face, by which cooling process his flagging energies were revived.",
gq-0359,I intend to invite Prince Genji,"for the battle he was to fight with him who had robbed Dona Rodriguez’s daughter of her honour, for whom he hoped to obtain satisfaction for the wrong and injury shamefully done to her.",
gq-0360,"He was soon admiring Genji’s rustic house,","and settling the point; tell me, Sancho my friend, what do they say about me in the village here?",
gq-0365,Finally Genji got them to move his things into a sort of shed,"but as they did not burn him, he did not care two farthings for them.",
gq-0366,"This was just what the old gentleman wanted,",and to bring back an answer as good as the one he brought back before.,
gq-0368,It may easily be imagined that he left,"forty reals and three-quarters; and over and above this sum, which Sancho at once disbursed, Master Pedro asked for two reals for his trouble in catching the ape.",E
gq-0369,Thus admirably served and lodged Genji began to regain some of his equanimity,"unless it was that in the course of the night Sancho finished off his task, whereat Don Quixote was beyond measure joyful.",
gq-0370,"He stationed himself at the far end of the house,","he clung more to their truth than to their falsehood, the very reverse of Sancho, who held them all to be downright lies.",E
gq-0371,"One quiet moonlit night, when a cloudless sky stretched over the wide sea,","arrayed and adorned as became her rank and beauty, and in full festival and ceremonial attire.",
gq-0372,"The Governor could not contain himself,",and with him sheltered himself from the hailstorm that poured on both of them.,
gq-0374,"Presently he handed the large zithern to Genji, who struck a few chords,",but he would tell him if they happened to be going the same road.,
gq-0375,It may be imagined then how enchanting was,"his ass, so well pleased to have him with him that he would not have changed places with the emperor of Germany.",E
gq-0376,The old recluse then played so delightfully,until they had him fairly housed in a hostel in the heart of the city.,E
gq-0377,He spoke with so much enthusiasm and discernment that Genji was charmed with him,out of the darkness into the light of day.,E
gq-0378,"She certainly sounded very interesting, and despite the old man’s volubility Genji found",they did not fail to discuss the story of Marcela and Chrysostom as well as the madness of Don Quixote.,E
gq-0380,"The poem did strike Genji as somewhat forward in tone,","May thy falsehood to me Find its punishment in her, For in my land the just Often pays for the sinner.",
gq-0381,"The Emperor having assumed an attitude of respectful attention,",to all which the Judge gave such an attentive hearing that he never before had been so much of a hearer.,
gq-0382,"The Emperor was very much frightened, and being in any case somewhat uneasy at Genji’s prolonged absence","made off, ready to die with laughing, leaving him fastened in such a way that it was impossible for him to release himself.",E
gq-0383,It seemed somehow to be accepted that,everything won his heart.,E
gq-0384,The Lady of Akashi was convinced that,all the mares in the Cordova pastures would not lead him into an impropriety.,E
gq-0385,"The old priest looked in his calendar, chose a lucky day,",and peered between the legs of Rocinante to see if he could now discover what it was that caused him such fear and apprehension.,
gq-0386,"His host had provided him with a magnificent coach,",leaning against the bars as silent and as patient as if he were a stone statue and not a man of flesh.,
gq-0387,"Why, wondered Genji, was he, who took such pleasure in quiet and harmless pursuits,","completely puzzled, and asked Sancho if it was outside the city he had left them.",E
gq-0389,After this visit Genji’s first care was to perform the ceremonial Eight,"he seemed to feel lively and began pawing--for as to capering, begging his pardon, he knew not what it meant.",
gq-0393,"He was only eleven years old but was big for his age,",three kerchiefs that were worth three cities were missing.,E
gq-0395,Her one consolation had been that by her death Aoi had been spared the torture,"and the pair shut themselves up in his room, where they had another conversation not inferior to the previous one.",E
gq-0396,Genji continued to show her the same attentions as before his exile,and the first thing he saw was Don Fernando with Luscinda in his arms.,
gq-0397,"This was Genji’s first daughter,","of which a certain share fell upon Maritornes, who, irritated by the pain and flinging modesty aside, paid back so many in return to Sancho that she woke him up in spite of himself.",
gq-0398,She had sometimes done service at the Palace,so that they might all hear it.,E
gq-0399,These fresh tokens of Genji’s affection,"which, as he himself has told me, is the greatest victory anyone can desire.",E
gq-0400,"The messenger duly arrived, bearing with him the most touching","a knight-errant, and he becoming puffed up and exalted in consequence could not contain himself for satisfaction.",E
gq-0403,Power was now pretty equally divided between Genji himself,"and the bachelor, who came towards them with open arms.",E
gq-0404,"In the autumn Genji made his pilgrimage to the Shrine of Sumiyoshi,","hitting on the secret of the trick, but all concentrated on the promise, which he regarded as a certainty, of Dulcinea’s disenchantment.",
gq-0405,"She determined to renew the practice, and it so happened that she arrived",and smote him such a blow with it that Sancho dropped helpless to the ground.,
gq-0407,"She was told that this was Prince Yūgiri,",they approached slowly until they were near enough to hear distinctly Don Quixote’s voice calling to them.,
gq-0408,"This she did, while Genji, still unaware that she had been so near him,","let himself drop off Dapple at Rocinante’s feet, sore, bruised, and belaboured.",E
gq-0409,"This could not be denied,",Don Quixote sallied out of the inn to act as sentinel of the castle as he had promised.,
gq-0413,Before the funeral Genji called in person,upon us in place of the real husband.,
gq-0414,"The ladies concerned knew that their doings would probably reach Genji’s ears,","Don Quixote without his armour and in travelling gear, and Sancho on foot, Dapple being loaded with the armour.",
gq-0416,At last came Genji’s pardon and,he himself would make a fair copy of it.,E
gq-0418,Just let Prince Genji have a look at the place,for all would go well and turn out as he wished.,
gq-0419,I will go to Prince Genji at once,as he saw there was but little more left to read.,
gq-0420,"Even so, the ends of Genji’s trousers","embraced once more, and renewed their promises.",E
gq-0421,"At last, just as she had always predicted,",not daring to quit the trough and leave his armour unprotected.,E
gq-0423,It was well known in society that Genji,"must not go to Seville until he had cleared all these mountains of highwaymen and robbers, of whom report said they were full.",E
gq-0424,This jungle Genji now ordered to be reduced to tolerable dimensions; he had the ponds cleared,"they ransacked the alforjas, and without any ceremony very peacefully and sociably master and man made their repast on what they found in them.",
gq-0427,"It had at one time seemed as though Genji’s banishment might last indefinitely,","as the innkeeper had purposely extinguished the lantern on retreating to his room, he was compelled to have recourse to the hearth, where after much time and trouble he lit another lamp.",
gq-0428,But in the end it so turned out that Genji had already been back in the Capital,giving as excuse that he could find nothing more written about these achievements of Don Quixote than what has been already set forth.,E
gq-0432,"Somehow or other, in cases of this kind,","they told the curate all that had passed between him and them, not omitting what Sancho had been so silent about.",E
gq-0433,"There was indeed a letter and the gentlewomen had read it,",which Don Fernando seized at once and began to read by the light of one of the torches.,E
gq-0434,"He was brooding now over his loss,","so they allowed the others to go on before them, while they themselves followed slowly on foot.",E
gq-0435,"It was apparent in a moment that Suzaku suffered acutely while these subjects were being discussed,","but made her rise and embraced her with great courtesy and politeness, and ordered Sancho to look to Rocinante’s girths, and to arm him without a moment’s delay.",E
gq-0436,Presently Genji arrived at the Palace,"to permit her to recover and enjoy it, for which Sancho returned thanks in words that set them all laughing again.",E
gq-0440,"The spectators now clamoured only for more specimens of Genji’s handiwork,","so he rose from the table and going into the room where Zoraida was he took her by the hand, Luscinda, Dorothea, and the Judge’s daughter following her.",
gq-0441,"It was already nearing the dawn when Genji, feeling somewhat discursive,","came out in dismay, and ran to see who was uttering such cries, and those who were outside joined him.",
gq-0442,"Tō no Chūjō took the _wagon_, which he played,","and soundly kicked by Sancho, was on all fours feeling about for one of the table-knives to take a bloody revenge with.",
gq-0443,Sochi no Miya took the great-zithern,"and turning his eyes to the quarter where the sound had been heard, suddenly saw coming down the slope of a hill several men clad in white like penitents.",
gq-0445,Genji had a strong presentiment the Court ceremony,"fell in with his host’s humour, the banquet came to an end, they took their afternoon sleep, Sancho returned, and their conversation was resumed.",E
gq-0446,What part could she hope to play save the humiliating one,"and thus they bade each other farewell, and Sancho went away to make the necessary preparations for their expedition.",
gq-0447,"Little as she trusted Genji, she must not cut off her","sturdily built man, but not very tall in stature.",E
gq-0448,And since the spring they have been building this new hermitage,"and his squire parted from Don Quixote and Sancho, he meaning to go look for some village where he could plaster and strap his ribs.",
gq-0449,He noted that the old priest,"began to run all over his face and beard, whereat he was so startled that he cried out to Sancho:",E
gq-0451,A member of Genji’s personal servants now arrived,"but it seems Sancho’s bad luck so ordered it that the hermit was not at home, for so a sub-hermit they found in the hermitage told them.",
gq-0453,At last she took out the zithern,"not that he was sufficiently in his wits to guide the beast, but Dapple followed the footsteps of Rocinante, from whom he could not remain a moment separated.",
gq-0454,While things were going thus dismally,"they pursued their journey in quest of the banks of the famous Ebro, where that befell them which will be told in the following chapter.",
gq-0456,He had himself formed some slight acquaintance with her during the period of Genji’s exile,"and was grieved to the heart, for he thought he had got a patrimonial estate in that suit.",
gq-0460,"But while he was speaking the Lady of Akashi recalled the stories of Genji’s adventurous past,","bringing the one Sancho sent to Don Quixote, and this, too, was read out, and it raised some doubts as to the governor’s simplicity.",
gq-0461,All the time they were driving to the Capital Genji was haunted,"and when he found him leave off with so few, he thanked heaven in his heart.",
gq-0462,"But news had reached them of the pains which Genji was bestowing upon its upbringing,",but if he should be vanquished his opponent was released from the promise that was claimed against him and from all obligations to give satisfaction.,
gq-0464,"Thus everything seemed to be working very smoothly,","and by the side of this, having turned Dapple and Rocinante loose without headstall or bridle, the forlorn pair, master and man, seated themselves.",
gq-0467,During the first weeks of mourning Genji spent all his time at the Palace,he thought it best therefore to fold his arms and bow his head and reserve himself for a more favourable occasion and opportunity.,
gq-0468,"Thus Genji managed, by arguments which for fear of wearying you I will not repeat,","and Sancho (to whom he presented the ten crowns he had promised but had not until then given), left them with many expressions of good-will on both sides.",
gq-0469,"For years past it had struck the Emperor,","and Sancho, and the instant they came to the shore all the galleys struck their awnings and the clarions rang out.",
gq-0471,"But to Genji, he supposed,",the duchess asked him if Altisidora was in his good graces.,E
gq-0472,"But he longed, without actually letting out that he knew","turrets, portcullis, and drawbridge; for ever since he had been vanquished he talked more rationally about everything, as will be shown presently.",E
gq-0473,"She assumed in the household the place of a favourite elder daughter,","the one to finish off his task of scourging in the open country, the other to see it accomplished, for therein lay the accomplishment of his wishes.",
gq-0474,"So the old poet wished, and surely Prince Genji must be the answer to his prayer,","and proceeded to Don Quixote’s house, at the door of which they found his housekeeper and niece, whom the news of his arrival had already reached.",
gq-0476,"Genji had promised in due course to marry the child to the Heir Apparent,","without a tail and with buttocks as bare as felt, but not vicious-looking.",
gq-0477,"Quoting a poem of Uyeno Mine-o’s upon the death of Fujiwara no Mototsune,","Your servant, TERESA PANZA.",
gq-0478,"After his return from this unsuccessful expedition, Genji felt",particularly good and superior to those of Tronchon.,E
gq-0479,"For years past she had held, beyond challenge or doubt,","and laughed not a little, thinking it, as all did, the strangest form of madness a crazy intellect could be capable of.",
gq-0482,"To Princess Nyogo, too,","fearing it would not be believed, because here Don Quixote’s madness reaches the confines of the greatest that can be conceived, and even goes a couple of bowshots beyond the greatest.",
gq-0485,"It was high time to be thinking about the Initiation of Yūgiri,","and, with a lad carrying a candle-end, and the two damsels already mentioned, he returned to where Don Quixote stood, and bade him kneel down.",
gq-0486,It would in many ways have been better,"all stained with the rust of his armour; his collar was a falling one of scholastic cut, without starch or lace, his buskins buff-coloured, and his shoes polished.",
gq-0488,"When the time came for his Examinations,",with which Don Fernando and his companions were so delighted that they wished the story had been longer; so charmingly did Dorothea describe her misadventures.,
gq-0489,At the time when Genji first came across him,"the pack-saddle remained a caparison till the day of judgment, and the basin a helmet and the inn a castle in Don Quixote’s imagination.",E
gq-0490,About this time Tō no Chūjō became Palace Minister,but Don Quixote’s memory (though he had an excellent one) only carried away those that have been just quoted.,E
gq-0491,To have given my cousin Genji a daughter when he had waited,"from the end of his back-bone up to the nape of his neck, he was so sore that it nearly drove him out of his senses.",
gq-0492,"It was evident, from what she went on to say,","nor were Don Quixote’s knees altogether under control, for he too shook a little, squeezed his shoulders together and lost colour.",
gq-0493,"Yūgiri thinking that such an evening was wasted if not spent in agreeable company,","as has been described in the First Part of this great as well as accurate history, in the last chapter thereof.",
gq-0494,The Emperor Ryōzen was extremely loth to part with her,"and then charged the host to take great care of his horse, as he was the best bit of flesh that ever ate bread in this world.",
gq-0496,"But pretty as they all were, none of the others was handsome","insomuch that he set him down as a monster of some kind, or a human being of some new species or unearthly breed.",
gq-0497,The girl had a brother who was a page at Court,"coming forward in defence of their cause; and they exalted his wisdom to the same level with his courage, rating him as a Cid in arms, and a Cicero in eloquence.",E
