id,genji_half,quijote_half,review
gq-0001,"It should be explained that during the period when Tō no Chūjō kept Yūgiri away from Kumoi,",even they who were aware of the cause were frightened.,
gq-0002,"For example, her stepmother had even held her responsible for Makibashira's fall;",and Don Quixote went some twelve paces forward to meet her.,
gq-0003,The Akashi Princess was now back at the Imperial Palace;,"and the duchess showed Sancho's letter to the duke, who was highly delighted with it.",
gq-0004,"Koremitsu accordingly sent one of the lesser attendants to the house,","and made them a profound obeisance, which they returned by bowing their heads slightly.",
gq-0005,Having delivered this message Koremitsu brought in some of Genji's servants,"and went home to his village to wait there for Don Quixote, who was coming after him.",
gq-0006,"Nor was she far wrong,",so much did he enjoy everything connected with Sancho and Don Quixote.,
gq-0007,"Although it was early days to begin thinking about the little Akashi Princess's Initiation,",the duchess was as much delighted as Don Quixote was driven to desperation.,
gq-0008,It so happened that Genji was actually at Akikonomu's palace when the scented bales arrived;,for she found infinite enjoyment in listening to his shrewd remarks.,
gq-0009,"The claims, then, were pretty equally divided,","and so, highly amused at Sancho Panza's simplicities, they placed Don Quixote in the cart as before.",
gq-0010,"After performing before the Emperor, the Mummers visited the quarters of Lady Akikonomu,","to describe the end of the government of the great Sancho Panza, flower and mirror of all governors of islands.",
gq-0011,"He was the best-looking and most promising of Tō no Chūjō's sons,","and not understanding or heeding the words he addressed to her, she strove without speaking to free herself.",
gq-0012,"Her father Prince Hyōbukyō had never put himself out for her,","and making a bad bargain in every case, he got together a fair sum.",
gq-0013,"Koremitsu's son Hyōye no Jō was now sent to dig them up,","and with a better will, gulped down and drained off very little less than his master.",
gq-0014,"It was of course quite wrong that Kaoru, the child of a commoner,",should attempt the dread adventure.,
gq-0015,For several days Koremitsu did,and placed themselves one at each side of her.,
gq-0016,Koremitsu had patiently continued the enquiry,"and got his master's blessing, which Don Quixote gave him with tears, and he received blubbering.",
gq-0017,On hearing Koremitsu's report Genji's heart was filled with pity,"and dined with the duke and duchess, and set out the same evening.",
gq-0018,It was not as if Kumoi were a stranger;,and one of the largest the duke possessed.,
gq-0019,"Murasaki had adopted the Akashi Princess in its infancy,",the entreaties of the duke were so urgent that he had to accept it.,
gq-0020,The matter of Yūgiri and Kumoi,speaking to the lady in the coach,
gq-0021,Throughout this time Genji was constantly reminded of his separation from Oborozuki at the time,he was struck dumb and rigid from head to foot.,
gq-0022,The new quarters which Genji had built to the east of his palace were now ready,and the man answered with no less but rather much more sprightliness than the last one.,
gq-0023,"For example, her stepmother had even held her responsible for Makibashira’s fall;","and indeed, even they who were aware of the cause were frightened.",
gq-0024,"But Koremitsu regarded this as too great a tribute to so unimportant a lady,","and the duchess showed Sancho’s letter to the duke, who was highly delighted with it.",
gq-0025,"The story of Genji’s pollution had turned all visitors from the door,","and got his master’s blessing, which Don Quixote gave him with tears, and he received blubbering.",
gq-0027,Having delivered this message Koremitsu brought in some of Genji’s servants,that she might speak with Señor Don Quixote as much as she liked.,E
gq-0030,"When Genji first suggested it, Koremitsu did not at all take to the idea,",with his penance task which he had to perform for the disenchantment of Dulcinea.,
gq-0035,At the time when Ochiba was giving him no encouragement,"so as not to be recognised by Don Quixote, and set out following in the rear of the cart.",
gq-0036,"Consequently an aunt both of Asagao and Genji, who were first cousins;",declaring him to be the best knight that had ever been seen in any age.,
gq-0037,"The Emperor had heard that Genji was still on intimate terms with his aunt the Princess Oborozuki,",and that Don Quixote and Sancho should be conducted to their old quarters.,
gq-0038,"But under the influence of Kōkiden, who had subsequently thrust Oborozuki upon him,",in imitation of the lovers of Marcela.,
gq-0039,Utsusemi meanwhile had persuaded herself ,"and so, highly amused at Sancho Panza’s simplicities, they placed Don Quixote in the cart as before.",E
gq-0043,The Empress Akikonomu wrote constantly,"and Sancho remained standing to serve the cup, which was made of horn.",
gq-0044,Hyōbukyō could not fail to notice that Genji was suddenly,related to Don Quixote.,E
gq-0045,It may well be imagined with what consternation both Prince Hyōbukyō her brother and Genji himself,asked Sancho what was amiss with him.,E
gq-0046,"Prince Hyōbukyō had treated Genji with marked coldness in the period
before his exile",and a signal that he should attempt the dread adventure.,E
gq-0047,If Genji (and this seemed hardly credible) were waiting to secure Kumoi,so many more chains than the others.,
gq-0049,"Prince Higekuro served in the same Guard Regiment as Yūgiri,",And all for distant Dulcinea Del Toboso.,
gq-0050,It was the existence of this unfortunate entanglement that,"bent his brows, and before long two streams of tears escaped from his eyes.",E
gq-0054,Asagao was the one lady,and suggested that Luscinda would act and support Dorothea’s part sufficiently well.,
gq-0057,"They and their workmen, directed by the faithful Yoshikiyo, soon carried out Genji’s plans,",when he heard the audacious words of his squire!,
gq-0058,Yoshikiyo accordingly went back to Genji,"Ill-errant and bruised sore, Whom Rocinante bore In his wanderings to and fro.",
gq-0060,"And having got so far as to confess that Genji had known Yūgao,","he was found by Sancho and Carrasco, whom Don Quixote received with great courtesy.",
gq-0062,"Yes, they were surely made for one another; and Ukon doubted whether,","and Sancho went back to see Don Quixote, and make arrangements for their departure.",
gq-0063,It will be remembered that after Rokujō’s death Genji decided that her daughter Princess Akikonomu had best come,they had a discussion which the history records with great precision and scrupulous exactness.,
gq-0067,"No sooner had they entered than Murasaki’s father Prince Hyōbukyō rushed past them into the house,","safe, and sound, and you are left sore and sorry!",
gq-0068,"She had married off her adopted child,",he knew what he was about.,
gq-0069,"This time however, a celebration in which Hyōbukyō necessarily played the foremost part was being planned","and that he was called, by way of surname, the Knight of the Lions.",
gq-0072,"The man, Genji remembered, had been prostrate with fear;",regarding him as a man of worth and a stout one.,
gq-0073,Such treatment was certainly meant to be very friendly;,perceived he had his eyes shut and every appearance of being fast asleep.,
gq-0074,The song is addressed by a girl to a suspicious lover;,and learned the curious things promised by the man who carried the arms.,
gq-0075,When Genji was there she forgot her sorrow;,"and good fellowship at Don Quixote’s expense, for he was the height of generosity.",
gq-0076,You may say that a young man is bound to have his fling;,"and he said so to Sancho, explaining to him what was written on the standard.",
gq-0077,Genji’s son by Fujitsubo;,for he never relished mixing himself up in expeditions of that sort.,
gq-0078,Some of Genji’s servants became very restless and uneasy;,"and the duke mounted a fine horse, they placed the duchess in the middle and set out for the castle.",
gq-0079,A dazzling summer outfit was supplied for Genji’s use;,for a person of great good sense and greater rectitude of purpose?,
gq-0082,Now that Genji’s fortunes were again on the ascendant he appeared anxious to renew their former friendship;,and put on his travelling boots to hide the disaster to his stockings.,E
gq-0083,"How well Suzaku, with his almost girlish beauty, would have suited her;","taking Don Quixote between them, they proceeded to sit down to table.",
gq-0084,Soon after your birth there followed a species of convulsion in the state;,when he saw that his enemy was not coming on to the attack.,
gq-0085,"Fujitsubo, Genji was sure, would have given anything rather than that the boy should know;",making sure that he was about to say something foolish.,
gq-0086,"Like her father Tō no Chūjō, Tamakatsura (she conjectured) was doubtless good-looking;",and bidding farewell to Don Quixote resumed their journey.,
gq-0089,Yūgiri had already withdrawn his eye from the crack;,yielded to their request and supped with them.,
gq-0090,There had been some talk of their going on to Genji’s;,and bade adieu to his hosts by knocking at the partition of the other room.,
gq-0092,They were anxious to summon Genji;,"Don Quixote, and Sancho, together with six squires, set out for Barcelona.",
gq-0093,Murasaki longed to beg for an extension of her visit;,while Sancho did the same for Dapple.,E
gq-0094,Ukon took the letter and succeeded in conveying it to Tamakatsura at one of the rare moments,not only in body but in spirit.,
gq-0097,He had an idea that Fujitsubo,and found him pale and bathed with sweat.,
gq-0098,"Never once did he offer to perform a similar service in return,",that the gain by Don Quixote’s sanity can never equal the enjoyment his crazes give?,
gq-0100,Partly with the idea of securing Murasaki’s safety;,Don Quixote turned gaze upon the spot where he had fallen.,
gq-0101,Genji’s eyes indeed filled with tears when Suzaku first entered the room;,a great many more harassed him since his fall.,
gq-0102,The letter which he had handed to Murasaki was spread open before her;,"for the persons approaching them carried lances and bucklers, and were in very warlike guise.",
gq-0103,Above the partition he could see the far-off flicker of a lamp;,"and pointed them at his back and breast, menacing him with death.",
gq-0105,Time alone would convince Murasaki that nothing could change his feelings towards her;,"and not finding him at Saragossa, he went on, and how he fared has been already told.",
gq-0106,But it was perfectly true that this step had been imposed upon him;,and snatching up the rope he began to lay on and Don Quixote to count the lashes.,
gq-0107,"Look at Murasaki, she was much worse than you have been;",and adorned with painted serge hangings of the same sort.,
gq-0108,A word whispered by Genji in the Emperor’s ear would suffice to secure her future;,"for their hare, which Don Quixote gave them.",
gq-0110,"After talking of one thing and another, he went out with Genji to look at the flowers;","who fell weeping bitterly, as if they had him lying dead before them.",
gq-0112,"When the meal was over,",and had in full and forcible terms expressed his detestation of books of chivalry.,
gq-0113,"When therefore Suzaku repeated his invitation, this time in somewhat insistent terms,","and he fell a-shouting, calling upon Don Quixote to come and protect him.",
gq-0115,"Suzaku, who, as you know, took a lot of trouble with his daughters’ music,","waited for him, as he perceived that no one followed him.",
gq-0116,"The death of Prince Momozono meant, of course, the return to Court of the Kamo Vestal,","the landlord brought in the stew-pan just as it was, and he sat himself down to sup very resolutely.",
gq-0118,"Fujitsubo, who sat near by, was weeping bitterly;","though he was within half a league of it when night, somewhat dark and cloudy, overtook him.",
gq-0119,"Probably indeed, he said to himself, the whole idea of their resemblance was a mere fancy;","seeing himself left behind, he was forced to call to his master to wait for him.",
gq-0120,I can judge something of what poor Ochiba’s feelings must be by what I have seen,"this Don Quixote asked of him, telling him to take the money and keep it for himself.",
gq-0121,"It was natural that he should mention,",albeit he looked upon him as a madman?,
gq-0122,"There were no guest-rooms,",as sleeping would now do him more good than eating.,
gq-0124,And it seemed to Yūgiri exceedingly odd,as it was tempting God to engage in such a piece of folly.,
gq-0125,The news that Ochiba was soon returning,"not like a lover who had been discarded, but like a man who had been soundly kicked.",
gq-0126,Prince Higekuro was the elder brother,"who listening to Don Quixote, took him to be a sensible, clear-headed person.",
gq-0128,That Bugo no Suke had acted with rare courage and wisdom in planning the sudden flight,"and children, and engaged himself as esquire to his neighbour.",
gq-0131,He expressed his sorrow at her daughter’s bereavement and,"dismounting briskly from his ass, rushed towards him and began to strip off his gown.",E
gq-0132,"Why was it, he asked himself,",of necessity not so delicate as that of his master,E
gq-0133,"Yūgiri and Kumoi, these were the only grandchildren",but remembering his master’s wrath he checked himself in the midst of it.,
gq-0134,"However, when Yūgiri had begun his career it would be possible to see of what stuff he was made",and before day dawned he was far out of reach.,
gq-0135,"Once more the miracle-workers crowded round the bed, his parents were hastily summoned,",until he brought back word of having found his master.,E
gq-0136,The Emperor still showed no signs,caressed by Sancho without answering a single word.,E
gq-0138,"When the courtiers assembled to drink the Love Cup,",Sancho took his departure in such a flurry that he never missed them.,E
gq-0139,"That night Genji went to the Minister’s house,",that made the translator of the history say he considered this chapter apocryphal.,
gq-0140,"The Emperor still demanded Genji’s attendance at the Palace,",that the desire of acquiring fame is a very powerful motive.,
gq-0142,There were not many people about in the palace,"to find all this, Sancho?",
gq-0143,He begged so eagerly,"but do you know her house, Sancho?",E
gq-0145,"Tō no Chūjō handed over to them the decision of Genji’s question,","he returned full speed to seek his master, and found him sighing and uttering a thousand passionate lamentations.",
gq-0147,"So saying, he came","having extracted a laugh from his master’s profound melancholy, and excited fresh amazement in Don Diego.",
gq-0148,Still less do princes like you,"came up to his master, to whom there fell a terrific and desperate adventure.",
gq-0149,"Here he stopped, but Genji and the rest, wishing to hear the end of the story,",and protection of the enchanters with sorrow enough in his heart.,
gq-0151,This Ki no Kami was,where in a spacious chamber there was a table laid out with royal magnificence.,
gq-0155,"Her sleepy voice was so like the boy’s,",turning a considerable distance out of the road.,
gq-0157,But if I should touch this fine gentleman,to see what would be the upshot of his vainglorious and extraordinary proposal.,E
gq-0158,"She was no great beauty, Genji reflected,",and Sancho asked the landlord what he had to give them for supper.,
gq-0159,"He was not exactly handsome, but he had great charm",and restored to him the treasures and jewels they had stripped off Dapple.,
gq-0160,"The boy was quite content with this explanation,",and accidents that had happened his master.,
gq-0161,"He had already given a message to his sister,",so as not to let him leave the house.,
gq-0163,"He was well content to find himself lying by this handsome young Prince’s side,",and the sun smote Sancho on the eyes with his beams.,
gq-0164,We learn later that Genji courted this,as the object they had in view was now attained.,
gq-0165,"This worried the boy,",when wilt thou begin the scourging?,
gq-0166,"They entered unobserved at a side-gate,",and Sancho asked one of them what their quarrel was about.,
gq-0167,"Longing to catch sight of her, even though she were with a companion,",he asked them what it was those cloths covered.,
gq-0168,The best thing to be done under the circumstances was to wait,and Don Quixote had to give way and comply.,
gq-0170,The princely scent which still clung,and the bachelor Samson Carrasco busy with their breviaries.,
gq-0171,"Genji felt very uncomfortable, and making no answer on the supposed Mimbu’s behalf,","and his two friends, with Don Quixote and Sancho, went to the galleys.",
gq-0174,"Certain that Genji himself would be very much shocked,",and begged him to come down to where they stood.,
gq-0175,It occurred at once to Genji that it was,and so ended the adventure of the enchanted bark.,E
gq-0176,"Meanwhile, lighted only by a dim torch,","so exhilarated at finding himself now dubbed a knight, that his joy was like to burst his horse-girths.",
gq-0178,"After being many times roused Genji at last came out of Rokujō’s room,",the unlucky Don Quixote and Sancho alone were unable to move from where they were.,
gq-0180,One who had a favourite daughter would ask,so much so that he began to abandon the notion he had taken up about his being crazy.,
gq-0181,"What a queer place to be lying in! thought Genji,",fancying himself the most valorous knight-errant of the age in the world because of his late victory.,
gq-0184,It was of course contrary to etiquette that he should serve Genji himself,but so many thrust themselves between them that he could not avenge him.,
gq-0187,"A senior priest, son of the aged nun, now began to recite the Scriptures in an impressive voice,","begged him to give him what was left in the pigskin, which was no small quantity.",
gq-0188,"Hearing of his father’s distress and anxiety,","and four pages came forward to present him with water for his hands, which Sancho received with great dignity.",
gq-0189,"To Genji even the din of the cloth-beaters’ mallets had become dear through recollection,",and eager to serve his lord and lady he set off very willingly for Sancho’s village.,
gq-0190,"But after all Shōshō would probably not take that so very hard,",and gave thanks to God at the same time that his master had not found out what was the matter.,
gq-0193,The nun raised her head as she spoke,"and all who heard him, were kept hanging upon his lips.",
gq-0194,"Even Genji, peeping at the scene from a distance,","and when they asked who was there, Sancho Panza made answer that it was he.",
gq-0198,"How much the more so Prince Genji,","and though they were not very good, they were far better than those he put off.",
gq-0199,The nun at once perceived that the poem referred to her grandchild and supposed that,Sancho took his departure in such a flurry that he never missed them.,E
gq-0200,"Several of Genji’s friends now arrived to congratulate him upon his recovery,",from which he came back much relieved and more eager than ever to put his squire’s scheme into execution.,
gq-0203,"He asked many questions about the hermit’s magical powers,","knight-errant taking with him an esquire mounted on ass-back, but no instance occurred to his memory.",
gq-0205,He repeated all that Genji had told him to say,and that he means to publish them in hopes of Don Quixote’s third sally.,
gq-0207,The sight of the Emperor’s grief,and was soon out of reach.,
gq-0208,"And indeed, as Genji knew, it was not without good cause","though he does not deserve it, for he was the main cause of all this thrashing.",
gq-0209,When the man announced that Prince Genji had sent him for news,Was wont his wandering master to attend.,
gq-0210,This speech delighted Genji; but the gentlewomen of the household,flung the lady Dulcinea to the ground;,E
gq-0211,In the tenth month the Emperor was to visit the Suzaku-in,without dismounting from Dapple he followed in the footsteps of Rocinante.,
gq-0212,"This and more he wrote, and Genji",spurred Rocinante and mounted the hill.,E
gq-0216,"Murasaki was still asleep,",they cannot let her enjoy my incomparable constancy in peace!,
gq-0219,"She happened one day when she was talking with Genji to mention a certain princess,",but upon a tall mule of easy pace and handsomely caparisoned.,
gq-0220,"It was indeed on the night after the full moon,",just like one whose heart was pierced with grief at his defeat and his separation from Dulcinea.,
gq-0222,She remembered that Genji had often been obliged to reproach her,"all clad in ivy and hemp stained green, and looking so natural that they nearly terrified Sancho.",
gq-0223,"This aroused Chūjō’s curiosity and, despite the fact that he too had a secret appointment that night,",and what he was afraid of.,
gq-0225,Tō no Chūjō who had been,amazed afresh at the madness and wit of Don Quixote.,E
gq-0227,The place where Genji was waiting was well screened from view,since thou hast set thy tongue going against the peerless Dulcinea.,
gq-0228,She said the words in such a way that Genji was completely taken,"and duennas gathered round him, waiting in profound silence to hear what he would say.",
gq-0231,But it was not quite so large,"but answered him never a word, such was the distress and anguish the poor beast found himself in.",
gq-0233,As usual she seemed quite devoid of conversation,as fine as fine can be.,
gq-0234,Taking pity on them one of Genji’s servants went to their assistance,the duke with boar-spear did the same; but the duchess would have gone in front of them all had not the duke prevented her.,
gq-0236,The princess’s ancient gentlewomen realized that Genji did not approve of their mistress’s taste in colours,"till Sancho, perceiving that daybreak was coming on apace, very cautiously untied Rocinante and tied up his breeches.",
gq-0237,"The Emperor too could not bear that Fujitsubo should miss the spectacle,",it would be necessary to devise or discover some other way of getting him home.,
gq-0239,"She continued to use the somewhat outlying western wing which had now been put into excellent order,",in order that it may tell who the Knight of the Mirrors and his long-nosed squire were.,
gq-0240,"He was naturally very much gratified,",and Don Quixote placed himself at her service with an abundance of well-chosen and polished phrases.,
gq-0241,It was with bitterness that Genji remembered how long,"the claws of a cat, mishaps incidental to knight-errantry.",E
gq-0242,"There was a doll’s kitchen only three feet high but fitted out with all the proper utensils,",as they knew very well there was nothing in that inn fit for one of his sort.,
gq-0244,To Genji all these pretensions naturally seemed somewhat exaggerated,as he wanted to take them home for a token and memento of that unexampled adventure.,
gq-0248,The Emperor was impatient to see Fujitsubo’s child,and where the rocks and trees afforded a cool and grateful shade.,
gq-0249,"Fujitsubo meanwhile, fearing lest Genji’s continual visits should attract notice,","whereat Sancho was in high delight, as he had never seen any all his life.",
gq-0250,Its extraordinary resemblance to Genji was not remarked upon by the Emperor who,"limping, advanced as best he could to kneel before the noble pair.",E
gq-0252,"A succession of violent emotions—terror, shame, pride and love—passed through Genji’s breast","one leading to Don Quixote’s village, the other the road Don Alvaro was to follow.",
gq-0253,Stroking the lovely hair that had fallen forward across her lap,kept him from going to his master’s assistance.,E
gq-0254,The Emperor too had heard that there was someone living with Genji,"and leading her to a seat beside herself, requested her to remove her veil.",
gq-0258,It astonished Genji that despite her advancing years she,rained down upon him such a shower of fisticuffs that the poor knight’s face streamed with blood as freely as his own.,E
gq-0260,Wondering how much longer Genji would take to recognize him Chūjō did not say a word,"But hogsheads full--this doth he know-- Don Quixote’s tears are on the flow, And all for distant Dulcinea Del Toboso.",
gq-0261,In an interval Chūjō came up to Genji and asked him in a low voice,as everything would be done exactly as the books of chivalry required and described.,
gq-0262,Such marked preference did the Emperor show in his treatment of Genji that,"he lay down at once, being sorely shaken and in want of sleep.",E
gq-0263,An empress was appointed,"with the gracious permission of the lady of the castle, they took their departure, Don Quixote on Rocinante, and Sancho on Dapple.",
gq-0264,It was of course Fujitsubo whom,inasmuch as for a vanquished knight like himself it was fitter he should live in a pig-sty than in a royal palace.,
gq-0266,"The moon had risen very bright and clear, and Genji",declared Don Fernando to be a man of very little taste when he rejected such charms.,E
gq-0267,After the banquet Kōkiden herself had,filled with surprise at an incident so unlooked for.,
gq-0270,"The idea that so perfect a nature was in his hands,",was the reason that led him to go armed in that fashion in a country so peaceful.,
gq-0271,And so she waited in great impatience,"for a while with Sancho’s rich conversation, the melancholy sound of a fife and harsh discordant drum made itself heard.",
