id,genji_half,quijote_half,review
gq-1006,The voice in which these words were said was not Aoi’s;,"though with shorter words, and without calling upon him to pay the reckoning let him go with a Godspeed.",
gq-1007,He began trying to tell the Emperor something;,"lentils on Fridays, and a pigeon or so extra on Sundays, made away with three-quarters of his income.",
gq-1008,A quiet time at home would not do her any harm;,"what art thou plotting, what art thou devising?",
gq-1009,They had been ordered to wear dove-grey lined with pale green;,Noon but renews my wailing and my tears; And with the night again goes up my moan.,
gq-1010,On leave from the Palace;,and bathed in her blood they were still uncertain as to the true nature of the act.,
gq-1011,I suppose you would have been wearing it at the Emperor’s Chrysanthemum Feast;,"And Love spreads wing from Cyprus isle to fly, A chink to view so wondrous great and small.",
gq-1013,Nothing would be gained if I restored her to her father;,"and to protect her father against the kinsmen of Don Vicente and all the world, should they seek to injure him.",
gq-1014,They now begged for a drive;,"mounted on two dromedaries, for not less tall were the two mules they rode on.",
gq-1015,She was now Consort of the Emperor;,one morning before the dawning of the day (which was one of the hottest of the month of July),
gq-1016,Meanwhile the servants of Yūgao’s house were surprised that they had had no news from her,from which they concluded that the Distressed Duenna was making her entrance.,E
gq-1017,"The priests carrying the sacred image arrived somewhat late, and",Vivaldo proceeded to ask him what knights-errant meant.,E
gq-1021,"She was thinking with pleasure that the setting moon would light them on their way,",and roguishly; but the fair Dido was shown dropping tears the size of walnuts from her eyes.,
gq-1023,"Ki no Kami was surprised but by no means ill-pleased,","and surrounded him, urging him to return and console his father at once and without a moment’s delay.",
gq-1024,Genji had brought so many complications into his life that,"he was of a hardy habit, spare, gaunt-featured, a very early riser and a great sportsman.",E
gq-1025,"Yūgiri, as has been said before, saw very little of Murasaki;",it will be enough not to stray a hair’s breadth from the truth in the telling of it.,
gq-1026,"Suzaku must therefore at least know what Princess Akikonomu looked like; which was more than Genji did,","but he perceived one great defect in it, that it had no closed helmet, nothing but a simple morion.",
gq-1028,"Taking Murasaki with him he now inspected their contents and together they went through the whole collection,",they only asked him if he wanted anything to eat.,E
gq-1029,"But he was impatient to put matters right, and though it was very late indeed","the watching of the armour, and the dubbing ceremony he contemplated.",
gq-1030,"Among those that he had received at Suma, most of which he now tore up or threw away,",and returned to his beat with the same serenity as before.,
gq-1031,He would not for the world do anything to hurt her feelings;,and among them the landlord.,
gq-1033,Most people thought this step quite reasonable;,and with her followed almost the same conversation as with the lady of the sword.,
gq-1034,The ex-Emperor was of course represented; so were the Princess Kōkiden and the Heir Apparent;,"with four servants mounted, and three muleteers on foot.",
gq-1035,Again and again Murasaki,milled him like a measure of wheat.,E
gq-1036,Tō no Chūjō was puzzled by this; but he naturally assumed that it referred to the trouble concerning Kumoi,"and entirely, he considered, the fault of his horse.",
gq-1038,"The smallness and delicacy of his build, even the way in which his hair was cropped,",to rise was beyond his power.,
gq-1039,All day long Genji,only went on with his ballad.,
gq-1041,"She went on to pour out such a pitiful tale of things gone awry that Genji could bear it no longer,","and once more he fell asleep, leaving them marvelling at his madness.",
gq-1042,"At Genji’s palace Shōnagon, the little girl’s nurse, finding herself in a world of unimagined luxuries",as they saw that his anger was kindling.,
gq-1043,"When Genji was leaving next day his father-in-law came to his room and helped him to dress,",as he was not much given to going on foot.,
gq-1044,Genji did not pay,"and such other things as he could,",
gq-1045,"For a long while Chūjō had been waiting for an opportunity to expose this sanctimonious imposture,",attended by four or five persons on horseback and two muleteers on foot.,
gq-1046,At dawn Fujitsubo retired,and made off across the country faster than the wind.,
gq-1048,"At the time when the new appointments were being made, during the old Emperor’s reign",the pair made their repast peaceably and sociably.,
gq-1049,"From among these gentlemen and the learned doctors who were present Genji picked sides,",their savoury limpid waters in noble abundance.,
gq-1050,"Suddenly, however, while he was in the midst of these prayers, there was a louder thunder-clap than ever,",yet mingled with truth and sincerity.,
gq-1052,There were so few people to whom it would be in any way possible to entrust,"to defend maidens, to protect widows and to succour the orphans and the needy.",
gq-1053,A message came summoning,"and shortly after, the player came up, a very good-looking young man of about two-and-twenty.",
gq-1054,"Genji however professed himself quite unable to cope with the duties of so arduous a function,",because they savour of paganism.,E
gq-1055,"As regards Ryōzen, it was not of course recognized in the world that His Majesty was Genji’s son;",not to settle children in life against their will.,
gq-1057,"Genji was still haunted by the impermanence of worldly things, and now",he despaired without being hated.,E
gq-1060,Genji who was extremely sensitive to such changes did not fail to notice that there was,the quarter where he had heard the disturbance.,E
gq-1061,"And if I on my side object to the match on these grounds,",and each dropped the contest at the point at which the voice reached him.,
gq-1064,"This was the scent which pervaded the whole room and, blending with a strong odour of musk,",threatened if he did not pay to compel him in a way that he would not like.,E
gq-1066,"Soon they were joined by a troupe of dancers whom Genji had himself selected,",and buried a couple of ribs in his body.,
gq-1067,"But Tamakatsura had been too much surprised and shocked by Genji’s conduct to feel, for the moment,",that the poor knight in spite of himself came down backwards off his horse.,
gq-1069,And as for the other ladies in Genji’s household—their presence would not necessarily be a disadvantage;,rearing up she flung her rider to the ground over her haunches.,E
gq-1071,"And if it was with a slight feeling of disappointment that Yūgiri saw his hint so rapidly obeyed,",and in two words the knight becomes king.,
gq-1072,"But Genji always assured her that he too intended quite soon to quit the Court,",and all who have aided him in rising to so exalted a rank.,
gq-1074,Tō no Chūjō was anxious to show his good will towards Genji upon what appeared to be so auspicious an occasion;,"except that when he looked, his eyes turned in a little one towards the other.",
gq-1076,Every day Genji,had his unholy books brought him.,E
gq-1077,There was nothing that,was no fault of his.,E
gq-1078,Perhaps after all it was rather soon to begin suspending his nightly visits;,stood like an isolated peak among the others that surrounded it.,
gq-1081,"All this while Tō no Chūjō had been living at the Great Hall,",these three verses were all that could be plainly and perfectly deciphered.,
gq-1082,In the eighth month of this year,that he should have it copied on paper at the first village he came to.,
gq-1083,"He sent it by the hand of the Captain of the Senior Bodyguard,",who with such frankness showed thee the secrets and the joys of his heart?,
gq-1084,"He was assisted by Tō no Chūjō, by the Chief Secretary of Council,",let us take up the broken thread of my unhappy story.,
gq-1085,Don’t you know that Madam,fathomed or understood the wavering mind and unstable nature of a woman?,
gq-1086,It would oblige me if you would first help,that adored enemy of mine?,E
gq-1091,"At this moment Tō no Chūjō, drawn hither by the beauty of the autumn leaves,",and the simplicity of the servant?,
gq-1094,But it was apparent that the end was at hand;,and earth its shame can see.,
gq-1095,"It was whispered, in strictest confidence, from ear to ear;",liable to be tarnished and dimmed by every breath that touches it.,
gq-1096,"Next day, though it so happened that a large number of ladies-in-waiting",could have suspected it was a pretence.,E
gq-1097,But of these things,he perceived he was to come out of it wearied and vanquished.,E
gq-1099,His agitation upon being admitted to Fujitsubo was not indeed such as it would have been some years ago;,and new lovers were unable to conceal it.,
gq-1100,"These were considered the cleverest women of the day, and Fujitsubo",knew not what course to take to undo the mischief or find some ready escape from it.,E
gq-1101,And yet Ukon had,care to do what he saw to be needful.,E
gq-1102,Wife of the young Emperor,to the loss of your reputation and good name.,
gq-1104,"Moreover Suzaku was at the time in very bad health,",and scornfully rejected and rebuked?,
gq-1105,"As a matter of fact,",and promised on his own part to aid him in raising a monument so glorious.,
gq-1107,"This extravagant magnificence, besides relieving Suzaku’s feelings,","in a thousand ways he became the author of his own dishonour, while he believed he was insuring his happiness.",E
gq-1108,"It was particularly intended to annoy the lady’s guardian,",but none of them could give him any explanation.,E
gq-1109,"Judging from his own experience he knew that Suzaku’s complete lack of employment,",opportunities for the contrivance of this complication of misfortune.,E
gq-1111,Fortunately the cherry blossom was unusually early this year,and there was no one to be seen in all the space outside.,
gq-1112,"The pavilion of the musicians was some way off, and Suzaku suggested that those about him should send",the horses away to the stable.,
gq-1113,"The Procession left the Suzaku gate at the hour of the Hare,",a disposition by no means advantageous to a married man who has children to succeed to his name and position.,
gq-1114,"Knowing that the maple leaves would be particularly lovely at this season,",above all when surrounded by a host of determined enemies in their own country?,
gq-1116,Suzaku was deeply moved at hearing,it and muttering to himself as he translated it.,
gq-1119,"But Suzaku regarded him as weak,",and at the end of two hours came to himself.,
gq-1123,"That night at any rate, he thought, matters might be left as they were,",so much had the sea now got up.,E
gq-1125,"Tō no Ben and Senji,",although he would not accept any of their generous offers.,
gq-1126,He ought at this very time to have been supervising the arrangements,"and the ladies, who supped by themselves in their own room.",E
gq-1127,No one owes more to Suzaku than I do; ,and deep silence reigned all through the inn.,E
gq-1130,"A messenger was sent to Suzaku’s mountain temple,",oh luminary of the three faces!,
gq-1132,"It was now nearing dawn, and as Suzaku wished to be back in his monastery before daylight,",my eyes were filled with tears.,E
gq-1133,I do not want Suzaku to think that I have,however wise it might be!,
gq-1136,It reached Suzaku’s ears that she intended to stay at Ono,"that their law is their sword, their charter their prowess, and their edicts their will?",
gq-1142,Where Murasaki would not,yield herself up wholly to his will and pleasure?,E
gq-1143,"Next day the weather was wretched, and while storms of snow swept a sullen sky he sat with Murasaki,","as he had yesterday, before they caged him.",E
gq-1145,"The girl had grown very good-looking, and Murasaki, to whom her existence had once been a reminder of unpleasant things,",was satisfied by getting fame though it was infamy.,E
gq-1149,"Yūgiri was certainly, as regards birth and general advantages, more than the equal of Kumoi; indeed,",attributing to one saint the miracles of another!,
gq-1150,"Meanwhile Kumoi, convinced that Yūgiri’s engagement to the Nakatsukasa girl would soon be announced,",cannot keep quiet?,E
gq-1151,"Despite all the precautions of her family Kumoi’s early friendship with Yūgiri had become known,",and at the age of sixteen she was most lovely.,
gq-1152,Lady Rokujō’s daughter by her late husband Prince Zembō,of little substance and less worth.,E
gq-1157,Rokujō’s old palace in the Sixth Ward,in which the licentiate had entered the house given to him.,E
gq-1158,With these memories were blended others;,"so they went upstairs, and with them some of those who were present.",E
gq-1160,It did not escape the notice of Princess Ōmiya’s gentlewomen that Chūjō was anxious to keep Yūgiri,through a sieve.,E
gq-1161,"Quite unconscious of all the fuss that had been going on at the Great Hall,",reviving in itself the happy time when the order of knight-errantry was in the field.,
gq-1162,You and his Excellency may take it from me that,you are mightily mistaken.,E
gq-1166,"When he had played for a while,",a dozen lace-bobbins dares to wag her tongue and criticise the histories of knights-errant?,
gq-1167,"Yūgiri’s own neighbour, for example—the Lady from the Village of Falling",is the gift of great geniuses.,E
gq-1168,"Despite his friendship for the little Princess,","he who would make people take him for a fool, must not be one.",E
gq-1169,"Yūgiri’s new estate required more spacious quarters than were available in his father’s palace,",the departure should take place in three days from that time.,E
gq-1176,But I heard my servitors saying,you going to look for her?,
gq-1177,"In point of fact the arrangements for the service of the Forty-ninth Day were made almost entirely by Yūgiri,",it would be just and right,
gq-1178,"When supper was over and everything had quieted down,","robed and adorned--in fact, like what she is.",
gq-1179,"Yūgiri was convinced that if he presented himself at the Great Hall,",and saw the three village lasses close at hand.,
gq-1180,Yūgiri had fallen in love with her,preventing their companion from going on.,E
gq-1182,"Some of the professors and doctors whose own part in the ceremony was over had also left the palace,","emperors, pontiffs, knights, ladies, and divers other personages were introduced?",
gq-1183,Genji happened to be there when Hyōbukyō arrived,and that what seems to be abuse in the expression is high praise?,
gq-1184,It would have been impossible for anyone to speak more kindly than Genji had just spoken;,the other did no more than bring it to his nose.,
gq-1187,"Thus he remonstrated; and Genji, though at first he had been somewhat put out by finding that he was not alone,",had a nice taste in devising things of the sort.,E
gq-1188,I heard yesterday that to-day they are choosing the dancers and musicians,to break out in ribald satires or soulless sonnets.,E
gq-1191,The child looked so exquisitely beautiful as it lay crowing to itself and smiling,and at such a time!,E
gq-1192,At such a time it was impossible for Genji to leave her and there were many who,knew he was under a delusion.,E
gq-1193,"This was all, and it was written hastily, but to Genji",giving up his insane project.,E
gq-1199,"The feeling that he had successfully insisted upon Genji’s recall quite braced him,",frisking and gambolling all over the meadow.,E
gq-1200,"The Emperor himself was greatly relieved to see that the boy was shaping so well,",and he without a farthing; is there nothing else?,
gq-1201,"Fortunately Murasaki no longer showed any jealousy on this score,",looking for dainties in the bottom of the sea.,E
gq-1202,"Murasaki had a peculiar talent in such matters,",for a good cast of the bar or a neat thrust of the sword.,E
gq-1203,"The attentions which his brother had hitherto paid to Tamakatsura were, he suspected,",like the heaps of corn one sees on the threshing-floors.,
gq-1204,"The news that she was not Genji’s daughter hardly came as a surprise to him,","all clean, brisk, and blithe.",
gq-1205,"Being Murasaki’s brother, he was constantly at her apartments, and his present despondency seemed to prove that,",and all lay open to view in a great chest.,E
gq-1206,"For his reply Genji chose paper of the same colour as the blossom she had sent,",but abundant enough to feed an army.,
gq-1210,But even when Genji is away at the Nijō-in there are always a lot of people gathered round her,devising things of the sort.,E
gq-1212,"Of Tō no Chūjō’s sons, only the two eldest,",in what seemed to be a loose black coat garnished with crimson patches like flames.,
gq-1213,Master Kashiwagi here thought it was a very clever thing to take a poor girl away from her village,and in his hand he held a long staff.,
gq-1215,It will be remembered that Kashiwagi’s,return of faintness would take his life with it.,E
gq-1216,He was led into the house by a band,as it pleases him.,E
gq-1219,"Kashiwagi was to-day the representative of the Imperial Bodyguard,",as he was very hungry.,
gq-1221,Three days after Nyosan’s Initiation,"for the inn, which they reached a little before nightfall.",
gq-1222,"But he has had very little experience,","proceeding at a rapid pace, and beating a mule loaded with lances and halberds.",E
gq-1224,About the middle of the second,if they liked cheap water she would give it with great pleasure.,E
gq-1225,When night came he sent a note to Nyosan’s quarters saying that the snowy weather had upset him,"in the thickest part of the forest, they found him devoured by wolves?",
gq-1226,Evidently Nyosan’s people,"pointed out a place where the show might be fixed, which was done at once.",E
gq-1227,"Meanwhile she on her side felt that he had treated Nyosan almost contemptuously,","such as, perhaps, never was seen.",
gq-1229,After a short conversation she proceeded,and it is for wise men to reserve themselves for better occasions.,
gq-1230,"Henceforward they met very often, or when that was impossible,",in the house of the man that has been hanged?,E
gq-1232,"At this moment the cat gave a frenzied scream, and Nyosan turned her head,",honey is not for the mouth of the ass.,
gq-1233,"The cat was now straying at large,",thou soul of a tame mouse?,
gq-1236,"By the way, I think",very much the opposite of what he contemplated.,E
gq-1237,"But as a matter of fact he had already recognized Nyosan’s cat,",on a pure white palfrey or hackney caparisoned with green trappings and a silver-mounted side-saddle.,
gq-1241,But Kashiwagi was under no delusion that this alliance would in any way console him,but the way of washing they have here is worse than doing penance.,
gq-1242,And who is Nyosan that you should think it sacrilege,that one of the carts with the creaking wheels reached the spot.,
gq-1243,"Seeing that she was now awake,","as they call it, reaching to the feet, while the head was covered with a black veil.",
gq-1245,"But in the long run he would have to know,",and had given himself five lashes overnight.,
gq-1246,It is nice to think of that poor,care that nobody speaks evil of thee behind thy back.,E
gq-1247,"So saying, she unfolded the letter",men clad in mourning robes so long and flowing that they trailed upon the ground.,
gq-1248,"Her heart beating wildly,",through which might be descried a very long beard as white as snow.,
gq-1250,But this seduction of Nyosan,costs them little to make promises they have no intention or power of fulfilling.,E
gq-1251,That any one who belonged to him should turn elsewhere,when there is so much to be said about my own?,
gq-1253,But he spoke to Kashiwagi,for the delight and amusement of the dwellers on earth!,E
gq-1256,"Even if Kashiwagi only stays there till he recovers,",youth would not sooner become a nun than a duenna!,E
gq-1258,To see him now solemnly,in green ivy bearing on their shoulders a great wooden horse.,
gq-1259,"That evening Nyosan was much indisposed,",they retired with easy dignity the way they came.,
gq-1260,"But should the child, when it grew up, show a striking resemblance to Kashiwagi,",strolling about on the winds?,E
gq-1263,"To begin with, Kashiwagi had repeatedly betrayed","the pitcher, a blind man could see that.",E
gq-1265,For her life with Kashiwagi was such,sweet stimulator of the water-coolers!,E
gq-1266,Meanwhile Kashiwagi’s loss continued to be severely,"set on fire and extinguished again, fixed on the end of a cane.",E
gq-1270,At such moments some of the old bitterness against Kashiwagi would,"provoked their laughter; however, the governor’s orders were after all executed.",E
gq-1271,"He was given a zithern,",standing by his side with a whalebone wand in his hand.,E
gq-1272,"He dreamt that Kashiwagi appeared to him,","and taking a paper from his bosom, placed it in the governor’s hands.",
gq-1273,"He allowed Kashiwagi to take it away one day after the Lezpideza Concert,",and having read the contents said the matter was one to be discussed in private.,
gq-1274,"He began to talk about Kashiwagi,",a thousand leagues off was an honest fellow and a good soul.,
gq-1275,"He could not, however, forbear from reproaching her for showing more tenderness to the memory of Kashiwagi,",and the bystanders were again filled with admiration at their new governor’s judgments and sentences.,
gq-1277,"As messenger he chose his son Ben no Shōshō,",and ladies rode behind their squires.,E
gq-1278,There was the time,"and they directed their steps towards the house, which was not far off.",
gq-1281,"The celebration of Suzaku’s fiftieth birthday, again and again deferred,","for servants’ wages, which were becoming recklessly exorbitant.",
gq-1282,The Emperor could hardly contain,lewd or loose songs either by day or night.,
gq-1285,"The Emperor repented bitterly that he had not long ago made her a Lady-in-Waiting,",and not that poor scurvy knave.,E
gq-1290,In the spring an heir to the Throne was to be proclaimed,"caviar, and made of the eggs of fish, a great thirst-wakener.",
gq-1291,Again the Emperor was in great distress;,waiting to see what the haste with which he was putting on his clothes meant.,E
gq-1293,"So she spoke to the Emperor,",if he stooped and squeezed himself into a small compass.,E
gq-1294,The Emperor could not deny that she,had been badly treated and worse bruised.,E
gq-1295,"He sounded the Emperor upon this, and found that he would be very glad to",obey him in everything.,E
gq-1296,A chamberlain now came over to the Minister,and his lacquey features were revealed to public gaze.,
gq-1297,"A poem by the Chinese writer Po Chü-i about the death of Yang Kuei-fei,",they were very sorry he was leaving them.,E
gq-1301,"The Emperor himself was full of tender concern, and though messengers kept him constantly informed,","they found tables laid out, and choicely, plentifully, and neatly furnished.",E
gq-1302,"Overjoyed at her return,",birds that deceived by the colour fell into the danger they were flying from.,E
gq-1303,The words of the song were aimed at Aoi,especially if the stripes fall upon an ill-nourished and worse-fed body.,
gq-1304,"One day when he was at his apartments in the Emperor’s Palace,","pushing on to reach an inn which was in sight, apparently a league off.",
gq-1305,I wonder what the Emperor will say,for the kites had stolen them.,
gq-1306,"So moving and beautiful was this dance that at the end of it the Emperor’s eyes were wet,",with four of the pistols they call petronels in that country at his waist.,
gq-1308,She was the only child of the Emperor’s sister,to what desperate lengths dost thou lead those that give thee lodging in their bosoms!,
gq-1310,When this was over his Majesty,and the pilgrims did not at all enjoy seeing their property confiscated.,E
gq-1311,"All this was seen by His Majesty who, his toilet long ago completed,","watched them with wonder, and passed on.",E
gq-1313,"It was a great success and the Emperor presented him with a cloak,",to issue from the city.,
gq-1316,At this moment Aoi’s father came by and,there passed a tube of tin carefully adjusted and concealed from sight.,E
gq-1318,"Meanwhile Princess Aoi became strangely distraught,",and asked him what he was doing.,
gq-1319,"She brooded constantly upon the nature of her own feelings towards Aoi,",and lowered the yard with a prodigious rattle.,
gq-1321,"It seemed to her that she had been in a large magnificent room,",and how does that one man who goes along there whistling dare to whip so many?,
gq-1322,Suddenly Aoi was seized with the same choking-fit,that by her beauty she made death itself look beautiful.,E
gq-1323,"Though the masses for Aoi’s soul were now over,",so that in this way the vessel could not escape them.,
gq-1324,"In the space beyond Aoi’s curtained seat, packed away behind a screen,",the viceroy of the city was on the shore.,
gq-1325,"On New Year’s Day he paid the usual visits of ceremony to his father,",but not to expect pardon for his flagrant offence.,
gq-1327,"A vast number of Courtiers followed in his train,",as their behaviour savoured rather of madness than of bravado.,
gq-1329,True the Emperor had died without betraying,that the whole business was a piece of enchantment.,
gq-1330,"In person His Majesty much resembled the late Emperor,",and bound not to take up arms for a year.,
